{
  "$schema": "https://json-schema.org/draft/2020-12/schema",
  "$id": "entities.schema.json",
  "title": "entities",
  "type": "object",
  "properties": {
    "id": {
      "type": "string",
      "pattern": "^[A-Z][A-Z0-9_]*$"
    },
    "kind": {
      "type": "string",
      "enum": [
        "state",
        "institution",
        "person",
        "organization",
        "company",
        "asset"
      ]
    },
    "name": {
      "type": "object",
      "properties": {
        "it": {
          "type": "string",
          "minLength": 1
        },
        "en": {
          "type": "string",
          "minLength": 1
        }
      },
      "required": [
        "it"
      ],
      "additionalProperties": false
    },
    "domain": {
      "type": "string",
      "enum": [
        "commerce-infrastructure",
        "dependencies",
        "geopolitics",
        "influence-technology",
        "institutional",
        "intelligence-security",
        "persons",
        "targets"
      ]
    },
    "country": {
      "anyOf": [
        {
          "type": "string",
          "pattern": "^[A-Z]{2}$"
        },
        {
          "type": "null"
        }
      ]
    },
    "review": {
      "type": "object",
      "properties": {
        "status": {
          "type": "string",
          "enum": [
            "imported_unreviewed",
            "needs_review",
            "reviewed"
          ]
        },
        "notes": {
          "type": "array",
          "items": {
            "type": "string",
            "minLength": 1
          }
        },
        "translations": {
          "type": "object",
          "properties": {
            "en": {
              "type": "object",
              "properties": {
                "status": {
                  "type": "string",
                  "enum": [
                    "machine",
                    "reviewed"
                  ]
                },
                "source_hash": {
                  "type": "string",
                  "pattern": "^[0-9a-f]{16}$"
                }
              },
              "required": [
                "status",
                "source_hash"
              ],
              "additionalProperties": false
            }
          },
          "additionalProperties": false
        }
      },
      "required": [
        "status",
        "notes"
      ],
      "additionalProperties": false
    },
    "provenance": {
      "type": "array",
      "items": {
        "anyOf": [
          {
            "type": "object",
            "properties": {
              "file": {
                "type": "string",
                "format": "starts_with",
                "pattern": "^sources\\/.*"
              },
              "row": {
                "type": "integer",
                "exclusiveMinimum": 0,
                "maximum": 9007199254740991
              },
              "original": {
                "type": "object",
                "propertyNames": {
                  "type": "string"
                },
                "additionalProperties": {
                  "type": "string"
                }
              }
            },
            "required": [
              "file",
              "row",
              "original"
            ],
            "additionalProperties": false
          },
          {
            "type": "object",
            "properties": {
              "file": {
                "type": "string",
                "format": "starts_with",
                "pattern": "^sources\\/.*"
              },
              "line": {
                "type": "integer",
                "exclusiveMinimum": 0,
                "maximum": 9007199254740991
              },
              "original": {
                "type": "object",
                "properties": {
                  "text": {
                    "type": "string"
                  }
                },
                "required": [
                  "text"
                ],
                "additionalProperties": false
              }
            },
            "required": [
              "file",
              "line",
              "original"
            ],
            "additionalProperties": false
          }
        ]
      }
    }
  },
  "required": [
    "id",
    "kind",
    "name",
    "domain",
    "country",
    "review",
    "provenance"
  ],
  "additionalProperties": false
}
