{
  "id": "QA",
  "kind": "state",
  "name": {
    "it": "Qatar",
    "en": "Qatar"
  },
  "domain": "geopolitics",
  "country": "QA",
  "review": {
    "status": "imported_unreviewed",
    "notes": [],
    "translations": {
      "en": {
        "status": "machine",
        "source_hash": "9c17fa063f0ec062"
      }
    }
  },
  "provenance": [
    {
      "file": "sources/original/Fonte_07_Ragnatela_Attori_Interessi_Relazioni_Europa_2026-10-21_nodi.csv",
      "row": 31,
      "original": {
        "id": "QA",
        "name": "Qatar",
        "kind": "state",
        "domain": "geopolitics",
        "geo": "",
        "date_start": "",
        "date_end": "",
        "date_precision": "",
        "source_docs": "",
        "evidence_status": "",
        "note": ""
      }
    }
  ]
}
