{
  "id": "STARLINK",
  "kind": "company",
  "name": {
    "it": "Starlink",
    "en": "Starlink"
  },
  "domain": "commerce-infrastructure",
  "country": null,
  "review": {
    "status": "imported_unreviewed",
    "notes": [],
    "translations": {
      "en": {
        "status": "machine",
        "source_hash": "dd0c11b85e2c5ae5"
      }
    }
  },
  "provenance": [
    {
      "file": "sources/original/Fonte_07_Ragnatela_Attori_Interessi_Relazioni_Europa_2026-10-21_nodi.csv",
      "row": 123,
      "original": {
        "id": "STARLINK",
        "name": "Starlink",
        "kind": "company",
        "domain": "commerce-infrastructure",
        "geo": "",
        "date_start": "",
        "date_end": "",
        "date_precision": "",
        "source_docs": "",
        "evidence_status": "",
        "note": ""
      }
    }
  ]
}
