{
  "id": "NEWNEW",
  "kind": "company",
  "name": {
    "it": "NewNew Polar Bear (nave)",
    "en": "NewNew Polar Bear (ship)"
  },
  "domain": "commerce-infrastructure",
  "country": null,
  "review": {
    "status": "imported_unreviewed",
    "notes": [],
    "translations": {
      "en": {
        "status": "machine",
        "source_hash": "0a458e322f4dab7a"
      }
    }
  },
  "provenance": [
    {
      "file": "sources/original/Fonte_07_Ragnatela_Attori_Interessi_Relazioni_Europa_2026-10-21_nodi.csv",
      "row": 152,
      "original": {
        "id": "NEWNEW",
        "name": "NewNew Polar Bear (nave)",
        "kind": "company",
        "domain": "commerce-infrastructure",
        "geo": "",
        "date_start": "",
        "date_end": "",
        "date_precision": "",
        "source_docs": "",
        "evidence_status": "",
        "note": ""
      }
    }
  ]
}
