{
  "id": "BATT",
  "kind": "asset",
  "name": {
    "it": "Produzione batterie",
    "en": "Battery production"
  },
  "domain": "dependencies",
  "country": null,
  "review": {
    "status": "imported_unreviewed",
    "notes": [],
    "translations": {
      "en": {
        "status": "machine",
        "source_hash": "ff2b93655bf04d10"
      }
    }
  },
  "provenance": [
    {
      "file": "sources/original/Fonte_07_Ragnatela_Attori_Interessi_Relazioni_Europa_2026-10-21_nodi.csv",
      "row": 177,
      "original": {
        "id": "BATT",
        "name": "Produzione batterie",
        "kind": "asset",
        "domain": "dependencies",
        "geo": "",
        "date_start": "",
        "date_end": "",
        "date_precision": "",
        "source_docs": "",
        "evidence_status": "",
        "note": ""
      }
    }
  ]
}
