{
  "id": "REE",
  "kind": "asset",
  "name": {
    "it": "Terre rare e magneti industriali",
    "en": "Rare earths and industrial magnets"
  },
  "domain": "dependencies",
  "country": null,
  "review": {
    "status": "imported_unreviewed",
    "notes": [],
    "translations": {
      "en": {
        "status": "machine",
        "source_hash": "dc3594b50f65d296"
      }
    }
  },
  "provenance": [
    {
      "file": "sources/original/Fonte_07_Ragnatela_Attori_Interessi_Relazioni_Europa_2026-10-21_nodi.csv",
      "row": 175,
      "original": {
        "id": "REE",
        "name": "Terre rare e magneti industriali",
        "kind": "asset",
        "domain": "dependencies",
        "geo": "",
        "date_start": "",
        "date_end": "",
        "date_precision": "",
        "source_docs": "",
        "evidence_status": "",
        "note": ""
      }
    }
  ]
}
