{
  "id": "TOMALES",
  "kind": "company",
  "name": {
    "it": "Tomales Bay Capital",
    "en": "Tomales Bay Capital"
  },
  "domain": "commerce-infrastructure",
  "country": null,
  "review": {
    "status": "imported_unreviewed",
    "notes": [],
    "translations": {
      "en": {
        "status": "machine",
        "source_hash": "1b1737ec923e4cbe"
      }
    }
  },
  "provenance": [
    {
      "file": "sources/original/Fonte_07_Ragnatela_Attori_Interessi_Relazioni_Europa_2026-10-21_nodi.csv",
      "row": 138,
      "original": {
        "id": "TOMALES",
        "name": "Tomales Bay Capital",
        "kind": "company",
        "domain": "commerce-infrastructure",
        "geo": "",
        "date_start": "",
        "date_end": "",
        "date_precision": "",
        "source_docs": "",
        "evidence_status": "",
        "note": ""
      }
    }
  ]
}
