{
  "id": "KAPO",
  "kind": "institution",
  "name": {
    "it": "KAPO (sicurezza estone)",
    "en": "KAPO (Estonian security service)"
  },
  "domain": "institutional",
  "country": null,
  "review": {
    "status": "imported_unreviewed",
    "notes": [],
    "translations": {
      "en": {
        "status": "machine",
        "source_hash": "05dde5229b83e00e"
      }
    }
  },
  "provenance": [
    {
      "file": "sources/original/Fonte_07_Ragnatela_Attori_Interessi_Relazioni_Europa_2026-10-21_nodi.csv",
      "row": 41,
      "original": {
        "id": "KAPO",
        "name": "KAPO (sicurezza estone)",
        "kind": "institution",
        "domain": "institutional",
        "geo": "",
        "date_start": "",
        "date_end": "",
        "date_precision": "",
        "source_docs": "",
        "evidence_status": "",
        "note": ""
      }
    }
  ]
}
