{
  "id": "MAR",
  "kind": "person",
  "name": {
    "it": "Artem Marchevskyi",
    "en": "Artem Marchevskyi"
  },
  "domain": "persons",
  "country": null,
  "review": {
    "status": "imported_unreviewed",
    "notes": [],
    "translations": {
      "en": {
        "status": "machine",
        "source_hash": "c38fc5537c1953e9"
      }
    }
  },
  "provenance": [
    {
      "file": "sources/original/Fonte_07_Ragnatela_Attori_Interessi_Relazioni_Europa_2026-10-21_nodi.csv",
      "row": 70,
      "original": {
        "id": "MAR",
        "name": "Artem Marchevskyi",
        "kind": "person",
        "domain": "persons",
        "geo": "",
        "date_start": "",
        "date_end": "",
        "date_precision": "",
        "source_docs": "",
        "evidence_status": "",
        "note": ""
      }
    }
  ]
}
