{
  "id": "STRUCTURA",
  "kind": "organization",
  "name": {
    "it": "Structura",
    "en": "Structura"
  },
  "domain": "influence-technology",
  "country": null,
  "review": {
    "status": "imported_unreviewed",
    "notes": [],
    "translations": {
      "en": {
        "status": "machine",
        "source_hash": "eb668b1ecebc14b7"
      }
    }
  },
  "provenance": [
    {
      "file": "sources/original/Fonte_07_Ragnatela_Attori_Interessi_Relazioni_Europa_2026-10-21_nodi.csv",
      "row": 96,
      "original": {
        "id": "STRUCTURA",
        "name": "Structura",
        "kind": "organization",
        "domain": "influence-technology",
        "geo": "",
        "date_start": "",
        "date_end": "",
        "date_precision": "",
        "source_docs": "",
        "evidence_status": "",
        "note": ""
      }
    }
  ]
}
