{
  "id": "HORMUZ",
  "kind": "asset",
  "name": {
    "it": "Stretto di Hormuz / traffico energetico",
    "en": "Strait of Hormuz / energy traffic"
  },
  "domain": "dependencies",
  "country": null,
  "review": {
    "status": "imported_unreviewed",
    "notes": [],
    "translations": {
      "en": {
        "status": "machine",
        "source_hash": "af10b9cd89b12403"
      }
    }
  },
  "provenance": [
    {
      "file": "sources/original/Fonte_07_Ragnatela_Attori_Interessi_Relazioni_Europa_2026-10-21_nodi.csv",
      "row": 171,
      "original": {
        "id": "HORMUZ",
        "name": "Stretto di Hormuz / traffico energetico",
        "kind": "asset",
        "domain": "dependencies",
        "geo": "",
        "date_start": "",
        "date_end": "",
        "date_precision": "",
        "source_docs": "",
        "evidence_status": "",
        "note": ""
      }
    }
  ]
}
