{
  "id": "FRJ",
  "kind": "institution",
  "name": {
    "it": "Organi giudiziari francesi",
    "en": "French judicial bodies"
  },
  "domain": "institutional",
  "country": null,
  "review": {
    "status": "imported_unreviewed",
    "notes": [],
    "translations": {
      "en": {
        "status": "machine",
        "source_hash": "4e8536c29ace570e"
      }
    }
  },
  "provenance": [
    {
      "file": "sources/original/Fonte_07_Ragnatela_Attori_Interessi_Relazioni_Europa_2026-10-21_nodi.csv",
      "row": 50,
      "original": {
        "id": "FRJ",
        "name": "Organi giudiziari francesi",
        "kind": "institution",
        "domain": "institutional",
        "geo": "",
        "date_start": "",
        "date_end": "",
        "date_precision": "",
        "source_docs": "",
        "evidence_status": "",
        "note": ""
      }
    }
  ]
}
