{
  "id": "LOBITO",
  "kind": "asset",
  "name": {
    "it": "Corridoio di Lobito",
    "en": "Lobito Corridor"
  },
  "domain": "dependencies",
  "country": null,
  "review": {
    "status": "imported_unreviewed",
    "notes": [],
    "translations": {
      "en": {
        "status": "machine",
        "source_hash": "88ec4153f810962d"
      }
    }
  },
  "provenance": [
    {
      "file": "sources/original/Fonte_07_Ragnatela_Attori_Interessi_Relazioni_Europa_2026-10-21_nodi.csv",
      "row": 190,
      "original": {
        "id": "LOBITO",
        "name": "Corridoio di Lobito",
        "kind": "asset",
        "domain": "dependencies",
        "geo": "",
        "date_start": "",
        "date_end": "",
        "date_precision": "",
        "source_docs": "",
        "evidence_status": "",
        "note": ""
      }
    }
  ]
}
