{
  "id": "MD",
  "kind": "state",
  "name": {
    "it": "Repubblica di Moldova",
    "en": "Republic of Moldova"
  },
  "domain": "geopolitics",
  "country": "MD",
  "review": {
    "status": "imported_unreviewed",
    "notes": [],
    "translations": {
      "en": {
        "status": "machine",
        "source_hash": "f206b92f1bf59a2d"
      }
    }
  },
  "provenance": [
    {
      "file": "sources/original/Fonte_07_Ragnatela_Attori_Interessi_Relazioni_Europa_2026-10-21_nodi.csv",
      "row": 10,
      "original": {
        "id": "MD",
        "name": "Repubblica di Moldova",
        "kind": "state",
        "domain": "geopolitics",
        "geo": "",
        "date_start": "",
        "date_end": "",
        "date_precision": "",
        "source_docs": "",
        "evidence_status": "",
        "note": ""
      }
    }
  ]
}
